{
  "$schema": "https://json-schema.org/draft/2020-12/schema",
  "title": "Task Handoff",
  "type": "object",
  "additionalProperties": false,
  "required": [
    "task_id",
    "project_id",
    "source_repo",
    "from",
    "to",
    "goal",
    "background",
    "constraints",
    "deliverables",
    "created_at"
  ],
  "properties": {
    "task_id": { "type": "string", "minLength": 1 },
    "project_id": { "type": "string", "minLength": 1 },
    "workstream_id": { "type": "string", "minLength": 1 },
    "run_id": { "type": "string", "minLength": 1 },
    "source_repo": { "type": "string", "minLength": 1 },
    "from": { "type": "string", "minLength": 1 },
    "to": { "type": "string", "minLength": 1 },
    "goal": { "type": "string", "minLength": 1 },
    "background": {
      "type": "array",
      "items": { "type": "string", "minLength": 1 }
    },
    "constraints": {
      "type": "array",
      "items": { "type": "string", "minLength": 1 }
    },
    "deliverables": {
      "type": "array",
      "items": { "type": "string", "minLength": 1 }
    },
    "acceptance_criteria": {
      "type": "array",
      "items": { "type": "string", "minLength": 1 }
    },
    "risk_level": {
      "type": "string",
      "enum": ["low", "medium", "high", "critical"]
    },
    "requires_review": { "type": "boolean" },
    "questions": {
      "type": "array",
      "items": { "type": "string", "minLength": 1 }
    },
    "related_projects": {
      "type": "array",
      "items": { "type": "string", "minLength": 1 }
    },
    "created_at": { "type": "string", "minLength": 1 }
  }
}
