{
  "task_id": "yyyy-mm-dd-<topic>-001",
  "project_id": "<project-id>",
  "workstream_id": "<project-id>:daily-development",
  "run_id": "yyyy-mm-dd-<topic>-001-run-001",
  "source_repo": "<git-url>",
  "from": "chatgpt-web",
  "to": "then-codex-cli",
  "goal": "<one-sentence goal>",
  "background": [
    "<stable background fact>"
  ],
  "constraints": [
    "<hard constraint>"
  ],
  "deliverables": [
    "<expected output>"
  ],
  "acceptance_criteria": [
    "<verifiable acceptance criterion>"
  ],
  "risk_level": "medium",
  "requires_review": true,
  "questions": [],
  "related_projects": [],
  "created_at": "2026-04-19"
}
